{
	"typ": "Bezbariérovost",
	"popis": {
		"cs": "Hrad nabízí stálé i příležitostné muzejní expozice včetně kasemat. Z vyhlídkového ochozu se nabízí ojedinělý pohled na město Brno a jeho okolí. Po telefonické domluvě možnost parkování v areálu hradu. Bezbariérový vstup do hradu je bočními dveřmi středního křídla (vpravo), asistence zajistí mobilní nájezd. Bezbariérové WC ve všech patrech.",
		"en": "The castle offers permanent and occasional museum exhibits including casemates. There is a unique view around the Brno and its surroundings from the observation deck. Parking in the castle is possible after calling the reception. Barrier-free entrance to the castle is located in the middle wing of the castle (right). Assistance will ensure a mobile entrance. Barrier-free toilets are on all floors."
	},
	"okamžik_mapování": {
		"typ": "Časový okamžik",
		"datum_a_čas": "2019-09-27T09:30:00+02:00"
	},
	"příloha": [{
		"typ": "Digitální objekt",
		"url": "https://images-cdn.mapotic.com/bound/1600x900/n/_p_/media/image/geo/1304/83465/be654aec-b10d-40d4-87d4-34d0f98fd9a8.jpg",
		"autor_díla": [{
			"typ": "Člověk",
			"jméno": {
				"cs": "Jan"
			},
			"příjmení": {
				"cs": "Novák"
			}
		}],
		"typ_média": "http://www.iana.org/assignments/media-types/image/jpeg",
		"podmínky_užití": {
			"typ": "Podmínky užití",
			"obsahuje_autorské_dílo": true,
			"obsahuje_více_autorských_děl": false,
			"licence_autorského_díla": "https://creativecommons.org/licenses/by/4.0/",
			"originální_databáze": false,
			"ochrana_zvláštními_právy_pořizovatele_databáze": false,
			"obsahuje_osobní_údaje": false
		}
	}],
	"mapující_subjekt": [{
		"typ": "Osoba",
		"ičo": "44992785",
		"název": {
			"cs": "Město Brno"
		}
	}],
	"mapování_dle_metodiky": false,
	"tělesně_postižení_toaleta_přístupnost": "https://data.mvcr.gov.cz/zdroj/číselníky/stupně-přístupnosti/položky/přístupný",
	"tělesně_postižení_objekt_přístupnost": "https://data.mvcr.gov.cz/zdroj/číselníky/stupně-přístupnosti/položky/přístupný",
	"objekt_vyhrazené_parkování": true,
	"vstup_hlavní_nájezd": false,
	"vstup_hlavní_plošina": false,
	"vstup_hlavní_výtah": true
}